Sheet: Лист1
A1: 1 | B1: =RC[-1]*R[1]C[-1] -> 2 | C1: =RC[-1]*R[1]C[-1] -> 12
A2: 2 | B2: =RC[-1]*R[1]C[-1] -> 6 | C2: =RC[-1]*R[1]C[-1] -> 72
A3: 3 | B3: =RC[-1]*R[1]C[-1] -> 12 | C3: =RC[-1]*R[1]C[-1] -> 240
A4: 4 | B4: =RC[-1]*R[1]C[-1] -> 20 | C4: =RC[-1]*R[1]C[-1] -> 600
A5: 5 | B5: =RC[-1]*R[1]C[-1] -> 30 | C5: =RC[-1]*R[1]C[-1] -> 1260
A6: 6 | B6: =RC[-1]*R[1]C[-1] -> 42 | C6: =RC[-1]*R[1]C[-1] -> 2352
A7: 7 | B7: =RC[-1]*R[1]C[-1] -> 56 | C7: =RC[-1]*R[1]C[-1] -> 4032
A8: 8 | B8: =RC[-1]*R[1]C[-1] -> 72 | C8: =RC[-1]*R[1]C[-1] -> 6480
A9: 9 | B9: =RC[-1]*R[1]C[-1] -> 90 | C9: =RC[-1]*R[1]C[-1] -> 49500
A10: 10 | B10: =RC[-1]*R[1]C[-1] -> 550 | C10: =RC[-1]*R[1]C[-1] -> 484000
A11: =SUM(R[-10]C:R[-1]C) -> 55 | B11: =SUM(R[-10]C:R[-1]C) -> 880 | C11: =SUM(R[-10]C:R[-1]C) -> 548548